{
  "$schema": "https://json-schema.org/draft/2020-12/schema",
  "type": "array",
  "items": {
    "type": "object",
    "required": ["id", "name", "country", "type", "nationwide", "regionalScope", "temporalScope"],
    "properties": {
      "id":            { "type": "string" },
      "name":          { "type": "array" },
      "country":       {
        "type": "object",
        "required": ["isoCode"],
        "properties": { "isoCode": { "type": "string" } }
      },
      "type":          { "type": "string" },
      "nationwide":    { "type": "boolean" },
      "startDate":     { "type": "string" },
      "endDate":       { "type": "string" },
      "subdivisions":  { "type": ["array", "null"] },
      "groups":        { "type": ["array", "null"] },
      "regionalScope": { "type": "string" },
      "temporalScope": { "type": "string" },
      "comment":       { "type": ["array", "null"] },
      "tags":          { "type": ["array", "null"] }
    }
  }
}
